Change description,type of change,version,date of implementation,dev
Moved more settings to JSON for external flexibility,Added,unreleased,"November 1, 2021 6:30 PM",Jur de Mooij
Splitted taskSettings into a seperate system using JSON for task related fixed settings,Added,unreleased,"November 2, 2021 4:35 PM",Jur de Mooij
eDIA XR RIG fix (non-related to framework),Changed,unreleased,"November 1, 2021 3:37 PM",Jur de Mooij
Stimuli moving in local camera space,Changed,unreleased,"November 2, 2021 6:11 PM",Jur de Mooij
Removed SNT and BI clutter,Removed,unreleased,"November 1, 2021 3:36 PM",Jur de Mooij
Implemented Framework update manually which fixes a few big bugs,Fixed,unreleased,"November 1, 2021 8:03 PM",Jur de Mooij
Read ExperimentConfig.json and TaskConfig.json from disk,Added,unreleased,"November 3, 2021 7:23 PM",Jur de Mooij