Change description,type of change,version,date of implementation,dev,Created
Moved more settings to JSON for external flexibility,Added,unreleased,2021-11-01,Jur de Mooij,"November 1, 2021 6:30 PM"
Splitted taskSettings into a seperate system using JSON for task related fixed settings,Added,unreleased,2021-11-02,Jur de Mooij,"November 2, 2021 4:35 PM"
eDIA XR RIG fix (non-related to framework),Changed,unreleased,2021-11-01,Jur de Mooij,"November 1, 2021 3:37 PM"
Stimuli moving in local camera space,Changed,unreleased,2021-11-02,Jur de Mooij,"November 2, 2021 6:11 PM"
Removed SNT and BI clutter,Removed,unreleased,2021-11-01,Jur de Mooij,"November 1, 2021 3:36 PM"
Implemented Framework update manually which fixes a few big bugs,Fixed,unreleased,2021-11-01,Jur de Mooij,"November 1, 2021 8:03 PM"
Read ExperimentConfig.json and TaskConfig.json from disk,Added,unreleased,2021-11-03,Jur de Mooij,"November 3, 2021 7:23 PM"
Test extra line,Changed,0.1.0,2021-11-04,Jur de Mooij,"November 4, 2021 6:08 PM"
Another thes to split the shit,Added,0.1.0,2021-11-05,Jur de Mooij,"November 4, 2021 7:08 PM"